{
  "obligation_version": "pf-core-v0.4",
  "grant_id": "SCOPE-GRANT-CONTRACT",
  "grant_hash": "sha256:0000000000000000000000000000000000000000000000000000000000000000",
  "permitted_tools": ["protocol_editor.draft_change"],
  "blocked_tools": ["robot_queue.submit"],
  "approved_scope": "protocol_draft",
  "max_responsibility_level": "R4_methodological_modification",
  "constraints": {
    "single_use": false,
    "protocol_version": "protocol_v1",
    "requires_pf_core_trace": true
  },
  "expiration": {
    "expires_after": ["protocol_version_change"]
  },
  "verification_mode": "enforce_at_runtime"
}
